[
  {
    "source_id": "wave",
    "title": "wave / G1 bounded reference tools",
    "body_id": "g1",
    "capability": "{\"schema\":\"pulsemorph.shared_source_capability.v1\",\"registry_version\":\"1\",\"scope\":\"Shared cold-start capability guide; not user memory, planner authority, bounds/admission authority or rights approval.\",\"source\":{\"id\":\"wave\",\"repository_relative_path\":\"research/vendor/ProtoMotions/data/g1-kimodo-generated/proto/output_wave.motion\",\"sha256\":\"cb23fb229ca49116462624a8164d1755eff1c2e57dce75dfd896a1c24113bc93\"},\"body_profile_id\":\"g1\",\"duration_s\":4,\"controller\":{\"onnx_sha256\":\"a59baa3e04a951e5cf0b4cc68f24ebaafa9272714226618b99a5017dfc805b4c\",\"fixed_pretrained\":true,\"control_hz\":50,\"physics_hz\":1000,\"pd_mode\":\"BUILT_IN_PD\"},\"parameter_order\":[\"left_gain_a\",\"right_gain_a\",\"left_gain_b\",\"right_gain_b\",\"timing_shift_s\"],\"parameter_bounds\":{\"left_gain_a\":[0.35,1.6],\"right_gain_a\":[0.35,1.6],\"left_gain_b\":[0.35,1.6],\"right_gain_b\":[0.35,1.6],\"timing_shift_s\":[-0.3,0.3]},\"tools\":[\"global_clock_v1\",\"local_clock_1p4_2p8_v1\"],\"arm_envelope_windows_s\":[[0.4,2.0],[2.0,3.6]],\"observed_arm_windows_s\":[[0.8,1.6],[2.4,3.2]],\"observed_accent_window_s\":[1.8,3.2],\"timing_semantics\":{\"positive_shift\":\"Advances sampled source time; usually earlier events, not an additive delay.\",\"global_clock_v1\":\"t + shift*sin(pi*t/4)^2\",\"local_clock_1p4_2p8_v1\":\"Same bounded warp inside [1.4,2.8] only; source clock unchanged outside.\",\"caution\":\"Dominant observed whole-body joint-speed peak can switch events; target gains are not observed arm ratios.\"},\"limitations\":[\"Only two pinned four-second existing G1 references; no new learned weights or skills.\",\"Joint proxies and local physical gates are not aesthetic/human-preference or hardware/recovery certification.\",\"Each new request needs its own baseline, fixed goals and fresh measured physical acceptance.\"],\"evidence\":[{\"path\":\"src/pulsemorph/agentic/app/runtime.py\",\"sha256\":\"c09c563bf5895531b7eb03470bc3f6861fee09335c44a0676e1753e228c25863\",\"purpose\":\"current immutable source/tool allowlist and evaluator configuration\"},{\"path\":\"experiments/agentic/app/execute_app.py\",\"sha256\":\"5b985a1dd0454dfa5d84df8da49252b1dbd659cc1117c91e5ef6ef81c43c4e20\",\"purpose\":\"finite parameter validation and numeric executor\"},{\"path\":\"src/pulsemorph/agentic/multifeature_reference.py\",\"sha256\":\"3fce10070c3e97efbffde863702083e2a8fca7e7f8ec5980078a35b355db4a9f\",\"purpose\":\"global clock and section arm envelope\"},{\"path\":\"src/pulsemorph/agentic/local_multifeature_reference.py\",\"sha256\":\"ce494009c5b0a783a7f91c2a2741fd6312f5d560483a55c0081b42dc96c29eaa\",\"purpose\":\"fixed local clock window\"},{\"path\":\"experiments/agentic/evaluate_multifeature.py\",\"sha256\":\"c163ec3a1a3324f3dd0ce5f202cabc6cc5a6f91e53034b7dddcadac97ce89fcb\",\"purpose\":\"observed joint/accent feature implementation\"},{\"path\":\"artifacts/runs/agentic/app_public_environment_v1/physics_independent_audit.json\",\"sha256\":\"59426d642e1062b0852c329732d78ba3cd29e3c0259f215aa20834affc9062b5\",\"purpose\":\"audited no-audio wave baseline\"},{\"path\":\"artifacts/runs/agentic/app_public_environment_v1/physics_baseline/qvel.npy\",\"sha256\":\"c1099e13e5699ac1eadea1d299178f1cfebb8084e8afe573c0e18b38919deb9e\",\"purpose\":\"recorded actual joint velocity for accent\"},{\"path\":\"artifacts/runs/agentic/app_public_environment_v1/physics_baseline/state_times.npy\",\"sha256\":\"0aebe6d1fdb6e971871cf4d21377bf1b9e208eb993613778a33135d2c3914a90\",\"purpose\":\"recorded 50Hz actual state clock\"}],\"known_local_measurement\":{\"class\":\"no_audio_identity_baseline\",\"observed_accent_s\":2.679999999999816,\"min_root_height_m\":0.7891760339547439,\"mean_joint_rmse_rad\":0.15551259574552098,\"control_rows\":200,\"physics_steps\":4000}}",
    "evidence_class": "local_audited_capability_metadata",
    "license_scope": "Authored lab metadata only. Source code, pretrained model, motion clips and robot meshes retain separate terms; no redistribution or rights approval. See design/agentic/APP_COMPONENT_PROVENANCE.md."
  },
  {
    "source_id": "high5",
    "title": "high5 / G1 bounded reference tools",
    "body_id": "g1",
    "capability": "{\"schema\":\"pulsemorph.shared_source_capability.v1\",\"registry_version\":\"1\",\"scope\":\"Shared cold-start capability guide; not user memory, planner authority, bounds/admission authority or rights approval.\",\"source\":{\"id\":\"high5\",\"repository_relative_path\":\"research/vendor/ProtoMotions/data/g1-kimodo-generated/proto/output_high5.motion\",\"sha256\":\"ef666262b8cccfd5279ce07b84eba9684e39ba2ca1a1cd1e2b55715a0394cf44\"},\"body_profile_id\":\"g1\",\"duration_s\":4,\"controller\":{\"onnx_sha256\":\"a59baa3e04a951e5cf0b4cc68f24ebaafa9272714226618b99a5017dfc805b4c\",\"fixed_pretrained\":true,\"control_hz\":50,\"physics_hz\":1000,\"pd_mode\":\"BUILT_IN_PD\"},\"parameter_order\":[\"left_gain_a\",\"right_gain_a\",\"left_gain_b\",\"right_gain_b\",\"timing_shift_s\"],\"parameter_bounds\":{\"left_gain_a\":[0.35,1.6],\"right_gain_a\":[0.35,1.6],\"left_gain_b\":[0.35,1.6],\"right_gain_b\":[0.35,1.6],\"timing_shift_s\":[-0.3,0.3]},\"tools\":[\"global_clock_v1\",\"local_clock_1p4_2p8_v1\"],\"arm_envelope_windows_s\":[[0.4,2.0],[2.0,3.6]],\"observed_arm_windows_s\":[[0.8,1.6],[2.4,3.2]],\"observed_accent_window_s\":[1.8,3.2],\"timing_semantics\":{\"positive_shift\":\"Advances sampled source time; usually earlier events, not an additive delay.\",\"global_clock_v1\":\"t + shift*sin(pi*t/4)^2\",\"local_clock_1p4_2p8_v1\":\"Same bounded warp inside [1.4,2.8] only; source clock unchanged outside.\",\"caution\":\"Dominant observed whole-body joint-speed peak can switch events; target gains are not observed arm ratios.\"},\"limitations\":[\"Only two pinned four-second existing G1 references; no new learned weights or skills.\",\"Joint proxies and local physical gates are not aesthetic/human-preference or hardware/recovery certification.\",\"Each new request needs its own baseline, fixed goals and fresh measured physical acceptance.\"],\"evidence\":[{\"path\":\"src/pulsemorph/agentic/app/runtime.py\",\"sha256\":\"c09c563bf5895531b7eb03470bc3f6861fee09335c44a0676e1753e228c25863\",\"purpose\":\"current immutable source/tool allowlist and evaluator configuration\"},{\"path\":\"experiments/agentic/app/execute_app.py\",\"sha256\":\"5b985a1dd0454dfa5d84df8da49252b1dbd659cc1117c91e5ef6ef81c43c4e20\",\"purpose\":\"finite parameter validation and numeric executor\"},{\"path\":\"src/pulsemorph/agentic/multifeature_reference.py\",\"sha256\":\"3fce10070c3e97efbffde863702083e2a8fca7e7f8ec5980078a35b355db4a9f\",\"purpose\":\"global clock and section arm envelope\"},{\"path\":\"src/pulsemorph/agentic/local_multifeature_reference.py\",\"sha256\":\"ce494009c5b0a783a7f91c2a2741fd6312f5d560483a55c0081b42dc96c29eaa\",\"purpose\":\"fixed local clock window\"},{\"path\":\"experiments/agentic/evaluate_multifeature.py\",\"sha256\":\"c163ec3a1a3324f3dd0ce5f202cabc6cc5a6f91e53034b7dddcadac97ce89fcb\",\"purpose\":\"observed joint/accent feature implementation\"},{\"path\":\"artifacts/runs/agentic/high5_capability_v1_audit_v1/audit.json\",\"sha256\":\"b1c9f25192f94d48fb120e04c6a1e4d922456998d5b6ccce1522551cbd23fde2\",\"purpose\":\"audited global-clock finite-budget no-witness result\"},{\"path\":\"artifacts/runs/agentic/high5_local_capability_v1_audit_v2/audit.json\",\"sha256\":\"029b7b7aa325948aa0fbe59cd0599b4a7b9252d7363cd0daaa85507f65c1295a\",\"purpose\":\"audited local-clock specific-goal witness\"}],\"known_local_measurement\":{\"class\":\"separate_fixed_protocol_exploratory_feasibility_not_current_user_goal\",\"calibration_accent_s\":1.959999999999895,\"global_clock_search_status\":\"no_witness_within_budget\",\"global_best_observed_features\":[1.1341620370638026,0.6966374797241396,0.8583499453018856,0.9926385038641691,2.159999999999873],\"local_clock_search_status\":\"confirmed_witness\",\"local_witness_candidate\":\"high5_b__local_capability__37\",\"local_witness_parameters\":{\"left_gain_a\":1.1587112873069414,\"right_gain_a\":0.5505062944838495,\"left_gain_b\":0.35,\"right_gain_b\":0.9099463244822236,\"timing_shift_s\":-0.27707405016186226},\"local_witness_features\":[1.1145927262140978,0.6903255541056792,0.8149441710956955,1.0561788170530912,2.2199999999998665],\"specific_protocol_targets\":[1.1,0.75,0.75,1.1,2.2948072562358277],\"specific_protocol_tolerances\":[0.08,0.08,0.08,0.08,0.1],\"min_root_height_m\":0.7867603503255848,\"mean_joint_rmse_rad\":0.12976927404988828,\"limitation\":\"One bounded exploratory witness; not a new matched planner comparison, generalization guarantee or reusable target for another soundtrack.\"}}",
    "evidence_class": "local_audited_capability_metadata",
    "license_scope": "Authored lab metadata only. Source code, pretrained model, motion clips and robot meshes retain separate terms; no redistribution or rights approval. See design/agentic/APP_COMPONENT_PROVENANCE.md."
  }
]